[
  {
    "identity": {
      "csa_id": "CSA-801",
      "semantic_code": "GOV.FOUR_EYES.PRINCIPLE",
      "official_name": "Contrôle du principe de validation à Quatre-Yeux",
      "version": "1.0.0",
      "status": "ACTIVE",
      "created_at": "2026-03-01T00:00:00Z",
      "effective_date": "2026-03-15T00:00:00Z"
    },
    "classification": {
      "family": "CSA-800",
      "sub_family": "Quatre-Yeux",
      "domains": ["RMCS", "ESVP"],
      "criticality": "CRITICAL"
    },
    "governance": {
      "author": "Comité de Gouvernance Scientifique",
      "reviewer": "Secrétariat Général Scientifique",
      "authority": "Autorité Scientifique RMCS",
      "doctrinal_version": "P7-2026-003",
      "document_status": "ACTIVE",
      "criticality_level": "HIGH",
      "stability_level": "STABLE"
    },
    "scientific_description": {
      "objective": "Garantir qu'une décision ou révision exige l'intervention d'au moins deux validateurs distincts et habilités.",
      "scope": "Validation finale des DVS et dérogations normatives.",
      "limits": "Ne s'applique pas aux contrôles entièrement automatisés.",
      "hypotheses": "Les identités des acteurs sont authentifiées via PKI.",
      "exclusions": "Relectures purement informatives."
    },
    "execution": {
      "inputs": ["approval_signatures_list"],
      "preconditions": ["CRYPTO.SIGNER.AUTHORITY (CSA-103)"],
      "dependencies": ["CSA-103"],
      "method": "Analyse de disjonction des identités : Validateur_A ≠ Validateur_B, avec rôles disjoints.",
      "parameters": {},
      "postconditions": ["four_eyes_confirmed"]
    },
    "results": {
      "states": ["PASSED", "FAILED"],
      "justification": "Au moins deux signatures distinctes d'experts qualifiés sont présentes.",
      "proofs_used": ["approval_signatures_list"],
      "rules_applied": ["RMCS-GOV-04"],
      "confidence_level": 1.0,
      "exceptions": [
        {"code": "GOV_SINGLE_SIGNER", "description": "Une seule personne a visé le dossier."}
      ]
    },
    "references": {
      "doctrinal_documents": ["P7-2026-003"],
      "rmcs_ids": ["RMCS-GOV-04"],
      "esvp_requirements": ["ESVP-REQ-GOV-02"]
    },
    "history": []
  }
]